CODIGO,DISTRITO,DEPARTAMENTO,MUNICIPIO,ESTABLECIMIENTO,DIRECCION,TELEFONO,SUPERVISOR,DIRECTOR,NIVEL,SECTOR,AREA,STATUS,MODALIDAD,JORNADA,PLAN,DEPARTAMENTAL,NOMBRE_SIMPLIFICADO,TIPO_ESTABLECIMIENTO,ID_ESTABLECIMIENTO_FISICO,REGION,CLASIFICACION
18-01-0041-46,18-007,IZABAL,PUERTO BARRIOS,ESCUELA NACIONAL MIXTA DE CIENCIAS COMERCIALES DOMINGO JUARROS,14 CALLE Y 11 AVENIDA,79480444,EDVIN ADOLFO MORATAYA MENJIVAR,EDWIN NATALIO MARMOL LOAIZA,DIVERSIFICADO,OFICIAL,URBANA,ABIERTA,MONOLINGUE,MATUTINA,DIARIO(REGULAR),IZABAL,ESCUELA NACIONAL MIXTA CIENCIAS COMERCIALES DOMINGO JUARROS,ESCUELA,ESCUELA NACIONAL MIXTA CIENCIAS COMERCIALES DOMINGO JUARROS_14_CALLE_Y_11_AVENIDA,ORIENTE,OFICIAL_MONOLINGUE_DIARIO(REGULAR)
18-01-0042-46,18-008,IZABAL,PUERTO BARRIOS,ESCUELA PARTICULAR MIXTA JUSTO RUFINO BARRIOS,8A AVENIDA ENTRE 17 Y 18 CALLES,79487032,ELENA ELIZABETH SUCHITE GARNICA DE QUINTANILLA,MARIO RENÉ JUÁREZ SALGUERO,DIVERSIFICADO,PRIVADO,URBANA,ABIERTA,MONOLINGUE,VESPERTINA,DIARIO(REGULAR),IZABAL,ESCUELA PARTICULAR MIXTA JUSTO RUFINO BARRIOS,ESCUELA,ESCUELA PARTICULAR MIXTA JUSTO RUFINO BARRIOS_8A_AVENIDA_ENTRE_17_Y_18_CALLES,ORIENTE,PRIVADO_MONOLINGUE_DIARIO(REGULAR)
18-01-0045-46,18-008,IZABAL,PUERTO BARRIOS,COLEGIO PARTICULAR MIXTO CRISTO REY,10A CALLE ENTRE 8A Y 9A AVENIDAS,79488225,ELENA ELIZABETH SUCHITE GARNICA DE QUINTANILLA,JAVIER ESTUARDO LÓPEZ TOBAR,DIVERSIFICADO,PRIVADO,URBANA,ABIERTA,MONOLINGUE,VESPERTINA,DIARIO(REGULAR),IZABAL,COLEGIO PARTICULAR CRISTO REY,COLEGIO,COLEGIO PARTICULAR CRISTO REY_10A_CALLE_ENTRE_8A_Y_9A_AVENIDAS,ORIENTE,PRIVADO_MONOLINGUE_DIARIO(REGULAR)
18-01-0145-46,18-008,IZABAL,PUERTO BARRIOS,COLEGIO CRISTIANO PRIVADO MIXTO CRISTO VIENE,ALDEA ENTRE RIOS,40620273,ELENA ELIZABETH SUCHITE GARNICA DE QUINTANILLA,GRICELDA MAGALY LEMUS CALDERON,DIVERSIFICADO,PRIVADO,RURAL,ABIERTA,MONOLINGUE,VESPERTINA,DIARIO(REGULAR),IZABAL,COLEGIO CRISTIANO CRISTO VIENE,COLEGIO,COLEGIO CRISTIANO CRISTO VIENE_ALDEA_ENTRE_RIOS,ORIENTE,PRIVADO_MONOLINGUE_DIARIO(REGULAR)
18-01-0158-46,18-008,IZABAL,PUERTO BARRIOS,COLEGIO PARTICULAR MIXTO PIEDRAS NEGRAS,"COLONIA PIEDRAS NEGRAS, SANTO TOMAS DE CASTILLA",79453597,ELENA ELIZABETH SUCHITE GARNICA DE QUINTANILLA,LASTENIA CARÍAS SAMAYOA,DIVERSIFICADO,PRIVADO,RURAL,ABIERTA,MONOLINGUE,VESPERTINA,DIARIO(REGULAR),IZABAL,COLEGIO PARTICULAR PIEDRAS NEGRAS,COLEGIO,"COLEGIO PARTICULAR PIEDRAS NEGRAS_COLONIA_PIEDRAS_NEGRAS,_SANTO_TOMAS_DE_CASTILLA",ORIENTE,PRIVADO_MONOLINGUE_DIARIO(REGULAR)
18-01-0162-46,18-008,IZABAL,PUERTO BARRIOS,COLEGIO PARTICULAR MIXTO PIEDRAS NEGRAS,"COLONIA PIEDRAS NEGRAS, SANTO TOMÁS DE CASTILLA",41051885,ELENA ELIZABETH SUCHITE GARNICA DE QUINTANILLA,LASTENIA CARÍAS SAMAYOA,DIVERSIFICADO,PRIVADO,RURAL,ABIERTA,MONOLINGUE,DOBLE,FIN DE SEMANA,IZABAL,COLEGIO PARTICULAR PIEDRAS NEGRAS,COLEGIO,"COLEGIO PARTICULAR PIEDRAS NEGRAS_COLONIA_PIEDRAS_NEGRAS,_SANTO_TOMÁS_DE_CASTILLA",ORIENTE,PRIVADO_MONOLINGUE_FIN_DE_SEMANA
18-01-0164-46,18-008,IZABAL,PUERTO BARRIOS,LICEO TÉCNICO GUATEMALTECO IDETI,ALDEA PLACA NO. 1,57843058,ELENA ELIZABETH SUCHITE GARNICA DE QUINTANILLA,DAISY LORENA AGUIRRE VENTURA,DIVERSIFICADO,PRIVADO,RURAL,ABIERTA,MONOLINGUE,VESPERTINA,DIARIO(REGULAR),IZABAL,LICEO TECNICO GUATEMALTECO IDETI,LICEO,LICEO TECNICO GUATEMALTECO IDETI_ALDEA_PLACA_NO._1,ORIENTE,PRIVADO_MONOLINGUE_DIARIO(REGULAR)
18-01-0168-46,18-008,IZABAL,PUERTO BARRIOS,COLEGIO CRISTIANO MARANATHA,7A. AVENIDA ENTRE 16A. Y 17A. CALLES,79429136,ELENA ELIZABETH SUCHITE GARNICA DE QUINTANILLA,MARÍA ANTONIA OSORIO OLIVA,DIVERSIFICADO,PRIVADO,URBANA,ABIERTA,MONOLINGUE,VESPERTINA,DIARIO(REGULAR),IZABAL,COLEGIO CRISTIANO MARANATHA,COLEGIO,COLEGIO CRISTIANO MARANATHA_7A._AVENIDA_ENTRE_16A._Y_17A._CALLES,ORIENTE,PRIVADO_MONOLINGUE_DIARIO(REGULAR)
18-01-0173-46,18-007,IZABAL,PUERTO BARRIOS,INSTITUTO NACIONAL DE EDUCACIÓN DIVERSIFICADA,COLONIA SAN MANUEL,79480444,EDVIN ADOLFO MORATAYA MENJIVAR,ELIA ERSELI FRANCO CALDERÓN,DIVERSIFICADO,OFICIAL,RURAL,ABIERTA,MONOLINGUE,MATUTINA,DIARIO(REGULAR),IZABAL,INSTITUTO NACIONAL DIVERSIFICADA,INSTITUTO,INSTITUTO NACIONAL DIVERSIFICADA_COLONIA_SAN_MANUEL,ORIENTE,OFICIAL_MONOLINGUE_DIARIO(REGULAR)
18-01-0174-46,18-007,IZABAL,PUERTO BARRIOS,INSTITUTO NACIONAL DE EDUCACIÓN DIVERSIFICADA,COLONIA MARIA LUISA I,79484363,EDVIN ADOLFO MORATAYA MENJIVAR,ROSA ORFILIA ESQUIVEL AVILA,DIVERSIFICADO,OFICIAL,RURAL,ABIERTA,MONOLINGUE,VESPERTINA,DIARIO(REGULAR),IZABAL,INSTITUTO NACIONAL DIVERSIFICADA,INSTITUTO,INSTITUTO NACIONAL DIVERSIFICADA_COLONIA_MARIA_LUISA_I,ORIENTE,OFICIAL_MONOLINGUE_DIARIO(REGULAR)
18-01-0178-46,18-007,IZABAL,PUERTO BARRIOS,INSTITUTO NACIONAL DE EDUCACIÓN DIVERSIFICADA,ALDEA SAN MIGUELITO,41718527,EDVIN ADOLFO MORATAYA MENJIVAR,SALVADOR EZEQUIAS DE LEÓN ALFARO,DIVERSIFICADO,OFICIAL,RURAL,ABIERTA,MONOLINGUE,VESPERTINA,DIARIO(REGULAR),IZABAL,INSTITUTO NACIONAL DIVERSIFICADA,INSTITUTO,INSTITUTO NACIONAL DIVERSIFICADA_ALDEA_SAN_MIGUELITO,ORIENTE,OFICIAL_MONOLINGUE_DIARIO(REGULAR)
18-01-0182-46,18-008,IZABAL,PUERTO BARRIOS,INSTITUTO PARTICULAR MIXTO DESARROLLO Y CIENCIA,14 CALLE ENTRE 11 AVENIDA,79486407,ELENA ELIZABETH SUCHITE GARNICA DE QUINTANILLA,EDGAR ROMEO MARTÍNEZ CÁCERES,DIVERSIFICADO,PRIVADO,URBANA,ABIERTA,MONOLINGUE,DOBLE,FIN DE SEMANA,IZABAL,INSTITUTO PARTICULAR DESARROLLO CIENCIA,INSTITUTO,INSTITUTO PARTICULAR DESARROLLO CIENCIA_14_CALLE_ENTRE_11_AVENIDA,ORIENTE,PRIVADO_MONOLINGUE_FIN_DE_SEMANA
18-01-0185-46,18-008,IZABAL,PUERTO BARRIOS,INSTITUTO PARTICULAR MIXTO DESARROLLO Y CIENCIA,14 CALLE ENTRE 11 AVENIDA,79429434,ELENA ELIZABETH SUCHITE GARNICA DE QUINTANILLA,EDGAR ROMEO MARTÍNEZ CÁCERES,DIVERSIFICADO,PRIVADO,URBANA,ABIERTA,MONOLINGUE,DOBLE,FIN DE SEMANA,IZABAL,INSTITUTO PARTICULAR DESARROLLO CIENCIA,INSTITUTO,INSTITUTO PARTICULAR DESARROLLO CIENCIA_14_CALLE_ENTRE_11_AVENIDA,ORIENTE,PRIVADO_MONOLINGUE_FIN_DE_SEMANA
18-01-0205-46,18-008,IZABAL,PUERTO BARRIOS,INSTITUTO PREUNIVERSITARIO DE IZABAL PREU,COLONIA SAN CRISTOBAL ENTRE RIOS,49026498,ELENA ELIZABETH SUCHITE GARNICA DE QUINTANILLA,FREDY ANTONIO FLORES LÓPEZ,DIVERSIFICADO,PRIVADO,URBANA,ABIERTA,MONOLINGUE,VESPERTINA,DIARIO(REGULAR),IZABAL,INSTITUTO PREUNIVERSITARIO IZABAL PREU,INSTITUTO,INSTITUTO PREUNIVERSITARIO IZABAL PREU_COLONIA_SAN_CRISTOBAL_ENTRE_RIOS,ORIENTE,PRIVADO_MONOLINGUE_DIARIO(REGULAR)
18-01-0211-46,18-008,IZABAL,PUERTO BARRIOS,COLEGIO CRISTIANO PRIVADO MIXTO CRISTO VIENE,ALDEA ENTRE RIOS,79475041,ELENA ELIZABETH SUCHITE GARNICA DE QUINTANILLA,GRICELDA MAGALY LEMUS CALDERON,DIVERSIFICADO,PRIVADO,RURAL,ABIERTA,MONOLINGUE,DOBLE,FIN DE SEMANA,IZABAL,COLEGIO CRISTIANO CRISTO VIENE,COLEGIO,COLEGIO CRISTIANO CRISTO VIENE_ALDEA_ENTRE_RIOS,ORIENTE,PRIVADO_MONOLINGUE_FIN_DE_SEMANA
18-01-0237-46,18-008,IZABAL,PUERTO BARRIOS,LICEO TÉCNICO GUATEMALTECO IDETI,ALDEA LA PLACA NO. 1,57843058,ELENA ELIZABETH SUCHITE GARNICA DE QUINTANILLA,DAISY LORENA AGUIRRE VENTURA,DIVERSIFICADO,PRIVADO,RURAL,ABIERTA,MONOLINGUE,DOBLE,FIN DE SEMANA,IZABAL,LICEO TECNICO GUATEMALTECO IDETI,LICEO,LICEO TECNICO GUATEMALTECO IDETI_ALDEA_LA_PLACA_NO._1,ORIENTE,PRIVADO_MONOLINGUE_FIN_DE_SEMANA
18-01-0242-46,18-008,IZABAL,PUERTO BARRIOS,INSTITUTO PARTICULAR MIXTO JOSE MARIA BONILLA RUANO,19 CALLE 14 AVENIDAS,53108367,ELENA ELIZABETH SUCHITE GARNICA DE QUINTANILLA,GUSTAVO GUMERCINDO RODAS MAZARIEGOS,DIVERSIFICADO,PRIVADO,URBANA,ABIERTA,MONOLINGUE,DOBLE,FIN DE SEMANA,IZABAL,INSTITUTO PARTICULAR JOSE MARIA BONILLA RUANO,INSTITUTO,INSTITUTO PARTICULAR JOSE MARIA BONILLA RUANO_19_CALLE_14_AVENIDAS,ORIENTE,PRIVADO_MONOLINGUE_FIN_DE_SEMANA
18-01-0243-46,18-008,IZABAL,PUERTO BARRIOS,INSTITUTO PARTICULAR MIXTO JOSE MARIA BONILLA RUANO,19 CALLE 14 AVENIDAS,53108367,ELENA ELIZABETH SUCHITE GARNICA DE QUINTANILLA,GUSTAVO GUMERCINDO RODAS MAZARIEGOS,DIVERSIFICADO,PRIVADO,URBANA,ABIERTA,MONOLINGUE,DOBLE,FIN DE SEMANA,IZABAL,INSTITUTO PARTICULAR JOSE MARIA BONILLA RUANO,INSTITUTO,INSTITUTO PARTICULAR JOSE MARIA BONILLA RUANO_19_CALLE_14_AVENIDAS,ORIENTE,PRIVADO_MONOLINGUE_FIN_DE_SEMANA
18-01-0246-46,18-008,IZABAL,PUERTO BARRIOS,COLEGIO PARTICULAR MIXTO SHADDAI,"COLONIA SAN AGUSTIN, DE SANTO TOMAS DE CASTILLA",79453430,ELENA ELIZABETH SUCHITE GARNICA DE QUINTANILLA,HERLINDO ARTIGA MARROQUÍN,DIVERSIFICADO,PRIVADO,RURAL,ABIERTA,MONOLINGUE,VESPERTINA,DIARIO(REGULAR),IZABAL,COLEGIO PARTICULAR SHADDAI,COLEGIO,"COLEGIO PARTICULAR SHADDAI_COLONIA_SAN_AGUSTIN,_DE_SANTO_TOMAS_DE_CASTILLA",ORIENTE,PRIVADO_MONOLINGUE_DIARIO(REGULAR)
18-01-0276-46,18-008,IZABAL,PUERTO BARRIOS,COLEGIO CRISTIANO PRIVADO MIXTO CRISTO VIENE,ALDEA ENTRE RIOS,40620273,ELENA ELIZABETH SUCHITE GARNICA DE QUINTANILLA,GRICELDA MAGALY LEMUS CALDERON,DIVERSIFICADO,PRIVADO,RURAL,ABIERTA,MONOLINGUE,DOBLE,FIN DE SEMANA,IZABAL,COLEGIO CRISTIANO CRISTO VIENE,COLEGIO,COLEGIO CRISTIANO CRISTO VIENE_ALDEA_ENTRE_RIOS,ORIENTE,PRIVADO_MONOLINGUE_FIN_DE_SEMANA
18-01-0285-46,18-008,IZABAL,PUERTO BARRIOS,LICEO EDUCATIVO DE FORMACION INTEGRAL FUENTE DE VIDA,CASERIO COLINA II DE SANTO TOMAS DE CASTILLA,56112748,ELENA ELIZABETH SUCHITE GARNICA DE QUINTANILLA,MIRNA GUADALUPE SANDOVAL BARCENAS,DIVERSIFICADO,PRIVADO,URBANA,ABIERTA,MONOLINGUE,DOBLE,FIN DE SEMANA,IZABAL,LICEO EDUCATIVO FORMACION INTEGRAL FUENTE VIDA,LICEO,LICEO EDUCATIVO FORMACION INTEGRAL FUENTE VIDA_CASERIO_COLINA_II_DE_SANTO_TOMAS_DE_CASTILLA,ORIENTE,PRIVADO_MONOLINGUE_FIN_DE_SEMANA
18-01-0286-46,18-008,IZABAL,PUERTO BARRIOS,COLEGIO PARTICULAR MIXTO MATIAS DE GALVEZ,COLONIA PIEDRAS NEGRAS,50157184,ELENA ELIZABETH SUCHITE GARNICA DE QUINTANILLA,SINDY MARISOL NUÑEZ VALIENTE,DIVERSIFICADO,PRIVADO,RURAL,ABIERTA,MONOLINGUE,VESPERTINA,DIARIO(REGULAR),IZABAL,COLEGIO PARTICULAR MATIAS GALVEZ,COLEGIO,COLEGIO PARTICULAR MATIAS GALVEZ_COLONIA_PIEDRAS_NEGRAS,ORIENTE,PRIVADO_MONOLINGUE_DIARIO(REGULAR)
18-01-0300-46,18-009,IZABAL,PUERTO BARRIOS,"INSTITUTO TÉCNICO DE CAPACITACION Y PRODUCTIVIDAD, INTECAP",SANTO TOMAS DE CASTILLA,79483012,ANA MARIBEL CASTILLO DIAZ,NORA EUGENIA DÍAZ DÍAZ,DIVERSIFICADO,PRIVADO,RURAL,ABIERTA,MONOLINGUE,MATUTINA,DIARIO(REGULAR),IZABAL,"INSTITUTO TECNICO CAPACITACION PRODUCTIVIDAD, INTECAP",INSTITUTO,"INSTITUTO TECNICO CAPACITACION PRODUCTIVIDAD, INTECAP_SANTO_TOMAS_DE_CASTILLA",ORIENTE,PRIVADO_MONOLINGUE_DIARIO(REGULAR)
18-01-0313-46,18-008,IZABAL,PUERTO BARRIOS,COLEGIO MIXTO BILINGUE QUETZALLI,"3A. CALLE 15A. AVENIDA, COLONIA LAS FLORES, SANTO TOMAS DE CASTILLA",79600197,ELENA ELIZABETH SUCHITE GARNICA DE QUINTANILLA,JUAN CARLOS LUCERO ALVARADO,DIVERSIFICADO,PRIVADO,RURAL,ABIERTA,MONOLINGUE,MATUTINA,DIARIO(REGULAR),IZABAL,COLEGIO BILINGUE QUETZALLI,COLEGIO,"COLEGIO BILINGUE QUETZALLI_3A._CALLE_15A._AVENIDA,_COLONIA_LAS_FLORES,_SANTO_TOMAS_DE_CASTILLA",ORIENTE,PRIVADO_MONOLINGUE_DIARIO(REGULAR)
18-01-0317-46,18-007,IZABAL,PUERTO BARRIOS,INSTITUTO NACIONAL DE EDUCACIÓN DIVERSIFICADA -INED-,ALDEA SANTO TOMAS DE CASTILLA,41568056,EDVIN ADOLFO MORATAYA MENJIVAR,HUGO RANDOLFO BARRIENTOS MÉNDEZ,DIVERSIFICADO,OFICIAL,RURAL,ABIERTA,MONOLINGUE,VESPERTINA,DIARIO(REGULAR),IZABAL,INSTITUTO NACIONAL DIVERSIFICADA -INED-,INSTITUTO,INSTITUTO NACIONAL DIVERSIFICADA -INED-_ALDEA_SANTO_TOMAS_DE_CASTILLA,ORIENTE,OFICIAL_MONOLINGUE_DIARIO(REGULAR)
18-01-0319-46,18-008,IZABAL,PUERTO BARRIOS,INSTITUTO PREUNIVERSITARIO DE IZABAL PREU,"COLONIA SAN CRISTOBAL, ENTRE RIOS, PUERTO BARRIOS",49026498,ELENA ELIZABETH SUCHITE GARNICA DE QUINTANILLA,FREDY ANTONIO FLORES LÓPEZ,DIVERSIFICADO,PRIVADO,RURAL,ABIERTA,MONOLINGUE,DOBLE,FIN DE SEMANA,IZABAL,INSTITUTO PREUNIVERSITARIO IZABAL PREU,INSTITUTO,"INSTITUTO PREUNIVERSITARIO IZABAL PREU_COLONIA_SAN_CRISTOBAL,_ENTRE_RIOS,_PUERTO_BARRIOS",ORIENTE,PRIVADO_MONOLINGUE_FIN_DE_SEMANA
18-01-0320-46,18-008,IZABAL,PUERTO BARRIOS,COLEGIO PARTICULAR MIXTO MATÍAS DE GÁLVEZ,"COLONIA PIEDRAS NEGRAS, ALDEA SANTO TOMÁS DE CASTILLA",56142325,ELENA ELIZABETH SUCHITE GARNICA DE QUINTANILLA,SINDY MARISOL NUÑEZ VALIENTE,DIVERSIFICADO,PRIVADO,RURAL,ABIERTA,MONOLINGUE,DOBLE,FIN DE SEMANA,IZABAL,COLEGIO PARTICULAR MATÍAS GÁLVEZ,COLEGIO,"COLEGIO PARTICULAR MATÍAS GÁLVEZ_COLONIA_PIEDRAS_NEGRAS,_ALDEA_SANTO_TOMÁS_DE_CASTILLA",ORIENTE,PRIVADO_MONOLINGUE_FIN_DE_SEMANA
18-01-0325-46,18-008,IZABAL,PUERTO BARRIOS,INSTITUTO PARTICULAR MIXTO EL DIVINO MAESTRO,BARRIO EL PUEBLITO ALDEA SANTO TOMAS DE CASTILLA,79484009,ELENA ELIZABETH SUCHITE GARNICA DE QUINTANILLA,MANUEL DE JESÚS SAGASTUME CASASOLA,DIVERSIFICADO,PRIVADO,RURAL,ABIERTA,MONOLINGUE,DOBLE,FIN DE SEMANA,IZABAL,INSTITUTO PARTICULAR EL DIVINO MAESTRO,INSTITUTO,INSTITUTO PARTICULAR EL DIVINO MAESTRO_BARRIO_EL_PUEBLITO_ALDEA_SANTO_TOMAS_DE_CASTILLA,ORIENTE,PRIVADO_MONOLINGUE_FIN_DE_SEMANA
18-01-0326-46,18-008,IZABAL,PUERTO BARRIOS,COLEGIO LUTERANO CRISTO EL SALVADOR,4A. AVENIDA 12-13 CALLES,79488357,ELENA ELIZABETH SUCHITE GARNICA DE QUINTANILLA,RICARDO AUGUSTO CASASOLA ANLÉU,DIVERSIFICADO,PRIVADO,URBANA,ABIERTA,MONOLINGUE,VESPERTINA,DIARIO(REGULAR),IZABAL,COLEGIO LUTERANO CRISTO EL SALVADOR,COLEGIO,COLEGIO LUTERANO CRISTO EL SALVADOR_4A._AVENIDA_12-13_CALLES,ORIENTE,PRIVADO_MONOLINGUE_DIARIO(REGULAR)
18-01-0327-46,18-008,IZABAL,PUERTO BARRIOS,COLEGIO PRIVADO MIXTO ECOLOGICO CAMPO Y VIDA,ALDEA AGUA CALIENTE,46007362,ELENA ELIZABETH SUCHITE GARNICA DE QUINTANILLA,MARCO ANTONIO PÉREZ MONROY,DIVERSIFICADO,PRIVADO,RURAL,ABIERTA,MONOLINGUE,MATUTINA,DIARIO(REGULAR),IZABAL,COLEGIO ECOLOGICO CAMPO VIDA,COLEGIO,COLEGIO ECOLOGICO CAMPO VIDA_ALDEA_AGUA_CALIENTE,ORIENTE,PRIVADO_MONOLINGUE_DIARIO(REGULAR)
18-01-0337-46,18-007,IZABAL,PUERTO BARRIOS,INED PROF. HUGO LEONEL SANCÉ CETINO,21 CALLE 5A. Y 6A. AVENIDAS,54667746,EDVIN ADOLFO MORATAYA MENJIVAR,REGINA XIOMARA PEÑA GONZÁLEZ,DIVERSIFICADO,OFICIAL,URBANA,ABIERTA,MONOLINGUE,VESPERTINA,DIARIO(REGULAR),IZABAL,INED PROF. HUGO LEONEL SANCÉ CETINO,OTRO,INED PROF. HUGO LEONEL SANCÉ CETINO_21_CALLE_5A._Y_6A._AVENIDAS,ORIENTE,OFICIAL_MONOLINGUE_DIARIO(REGULAR)
18-01-0343-46,18-008,IZABAL,PUERTO BARRIOS,LICEO MIXTO BILINGÜE CANADIENSE,6A. CALLE Y 4A. AVENIDA,50307050,ELENA ELIZABETH SUCHITE GARNICA DE QUINTANILLA,WILMER EZEQUIEL MONGE MARTÍNEZ,DIVERSIFICADO,PRIVADO,URBANA,ABIERTA,MONOLINGUE,DOBLE,FIN DE SEMANA,IZABAL,LICEO BILINGÜE CANADIENSE,LICEO,LICEO BILINGÜE CANADIENSE_6A._CALLE_Y_4A._AVENIDA,ORIENTE,PRIVADO_MONOLINGUE_FIN_DE_SEMANA
18-01-0344-46,18-008,IZABAL,PUERTO BARRIOS,LICEO MIXTO BINLINGÜE CANADIENSE,6A. CALLE Y 4A. AVENIDA,50307050,ELENA ELIZABETH SUCHITE GARNICA DE QUINTANILLA,WILMER EZEQUIEL MONGE MARTÍNEZ,DIVERSIFICADO,PRIVADO,URBANA,ABIERTA,MONOLINGUE,DOBLE,FIN DE SEMANA,IZABAL,LICEO BINLINGÜE CANADIENSE,LICEO,LICEO BINLINGÜE CANADIENSE_6A._CALLE_Y_4A._AVENIDA,ORIENTE,PRIVADO_MONOLINGUE_FIN_DE_SEMANA
18-01-0352-46,18-008,IZABAL,PUERTO BARRIOS,LICEO EDUCATIVO DE FORMACION INTEGRAL FUENTE DE VIDA,"CASERIO COLINA II, ALDEA SANTO TOMAS DE CASTILLA",56112748,ELENA ELIZABETH SUCHITE GARNICA DE QUINTANILLA,MIRNA GUADALUPE SANDOVAL BARCENAS,DIVERSIFICADO,PRIVADO,RURAL,ABIERTA,MONOLINGUE,VESPERTINA,DIARIO(REGULAR),IZABAL,LICEO EDUCATIVO FORMACION INTEGRAL FUENTE VIDA,LICEO,"LICEO EDUCATIVO FORMACION INTEGRAL FUENTE VIDA_CASERIO_COLINA_II,_ALDEA_SANTO_TOMAS_DE_CASTILLA",ORIENTE,PRIVADO_MONOLINGUE_DIARIO(REGULAR)
18-01-0356-46,18-008,IZABAL,PUERTO BARRIOS,COLEGIO PRIVADO MIXTO SAN JOSE,"BARRIO EL PUEBLITO, SANTO TOMAS DE CASTILLA",79484877,ELENA ELIZABETH SUCHITE GARNICA DE QUINTANILLA,LESVIA LINETH CARDONA NOVA,DIVERSIFICADO,PRIVADO,RURAL,ABIERTA,MONOLINGUE,VESPERTINA,DIARIO(REGULAR),IZABAL,COLEGIO SAN JOSE,COLEGIO,"COLEGIO SAN JOSE_BARRIO_EL_PUEBLITO,_SANTO_TOMAS_DE_CASTILLA",ORIENTE,PRIVADO_MONOLINGUE_DIARIO(REGULAR)
18-01-0358-46,18-008,IZABAL,PUERTO BARRIOS,COLEGIO MIXTO BILINGÜE QUETZALLI,"3A. CALLE Y 15 AVENIDA, COLONIA LAS FLORES, SANTO TOMAS DE CASTILLA",79600197,ELENA ELIZABETH SUCHITE GARNICA DE QUINTANILLA,JUAN CARLOS LUCERO ALVARADO,DIVERSIFICADO,PRIVADO,RURAL,ABIERTA,MONOLINGUE,DOBLE,FIN DE SEMANA,IZABAL,COLEGIO BILINGÜE QUETZALLI,COLEGIO,"COLEGIO BILINGÜE QUETZALLI_3A._CALLE_Y_15_AVENIDA,_COLONIA_LAS_FLORES,_SANTO_TOMAS_DE_CASTILLA",ORIENTE,PRIVADO_MONOLINGUE_FIN_DE_SEMANA
18-01-0359-46,18-008,IZABAL,PUERTO BARRIOS,COLEGIO PARTICULAR MIXTO MIGUEL ANGEL ASTURIAS,11 CALLE ENTRE 10 Y 11 AVENIDAS,79481153,ELENA ELIZABETH SUCHITE GARNICA DE QUINTANILLA,LUBIA JUDITH ORELLANA SALAS,DIVERSIFICADO,PRIVADO,URBANA,ABIERTA,MONOLINGUE,DOBLE,FIN DE SEMANA,IZABAL,COLEGIO PARTICULAR MIGUEL ANGEL ASTURIAS,COLEGIO,COLEGIO PARTICULAR MIGUEL ANGEL ASTURIAS_11_CALLE_ENTRE_10_Y_11_AVENIDAS,ORIENTE,PRIVADO_MONOLINGUE_FIN_DE_SEMANA
18-01-0365-46,18-008,IZABAL,PUERTO BARRIOS,LICEO DR. LUIS VON AHN,12 AVENIDA ENTRE 10 Y 11 CALLES,79524680,ELENA ELIZABETH SUCHITE GARNICA DE QUINTANILLA,ANGEL FELIPE LARIOS MELENDEZ,DIVERSIFICADO,PRIVADO,URBANA,ABIERTA,MONOLINGUE,VESPERTINA,DIARIO(REGULAR),IZABAL,LICEO DR. LUIS VON AHN,LICEO,LICEO DR. LUIS VON AHN_12_AVENIDA_ENTRE_10_Y_11_CALLES,ORIENTE,PRIVADO_MONOLINGUE_DIARIO(REGULAR)
18-01-0368-46,18-008,IZABAL,PUERTO BARRIOS,COLEGIO CRISTIANO MIXTO BILINGUE MI DULCE PARAISO,"4A, CALLE 15 AVENIDA, COLONIA SAN AGUSTIN, ALDEA SANTO TOMAS DE CASTILLA",79524378,ELENA ELIZABETH SUCHITE GARNICA DE QUINTANILLA,MAGGIE SHAUNNY MUÑOZ SALGUERO,DIVERSIFICADO,PRIVADO,RURAL,ABIERTA,MONOLINGUE,VESPERTINA,DIARIO(REGULAR),IZABAL,COLEGIO CRISTIANO BILINGUE MI DULCE PARAISO,COLEGIO,"COLEGIO CRISTIANO BILINGUE MI DULCE PARAISO_4A,_CALLE_15_AVENIDA,_COLONIA_SAN_AGUSTIN,_ALDEA_SANTO_TOMAS_DE_CASTILLA",ORIENTE,PRIVADO_MONOLINGUE_DIARIO(REGULAR)
18-01-0369-46,18-008,IZABAL,PUERTO BARRIOS,COLEGIO BILINGÜE ABC,21 AVENIDA  ENTRE 17-18 CALLE,79429590,ELENA ELIZABETH SUCHITE GARNICA DE QUINTANILLA,DORA LETICIA CARDONA DE LA CRUZ,DIVERSIFICADO,PRIVADO,URBANA,ABIERTA,MONOLINGUE,DOBLE,DIARIO(REGULAR),IZABAL,COLEGIO BILINGÜE ABC,COLEGIO,COLEGIO BILINGÜE ABC_21_AVENIDA__ENTRE_17-18_CALLE,ORIENTE,PRIVADO_MONOLINGUE_DIARIO(REGULAR)
18-01-0377-46,18-008,IZABAL,PUERTO BARRIOS,INSTITUTO PARTICULAR MIXTO ADONAI,CASERIO LA REFINERIA,54837080,ELENA ELIZABETH SUCHITE GARNICA DE QUINTANILLA,SANDRA PATRICIA LÓPEZ JORDÁN,DIVERSIFICADO,PRIVADO,URBANA,ABIERTA,MONOLINGUE,DOBLE,FIN DE SEMANA,IZABAL,INSTITUTO PARTICULAR ADONAI,INSTITUTO,INSTITUTO PARTICULAR ADONAI_CASERIO_LA_REFINERIA,ORIENTE,PRIVADO_MONOLINGUE_FIN_DE_SEMANA
18-01-0378-46,18-008,IZABAL,PUERTO BARRIOS,INSTITUTO PARTICULAR MIXTO ADONAI,CASERIO LA REFINERIA,54837080,ELENA ELIZABETH SUCHITE GARNICA DE QUINTANILLA,SANDRA PATRICIA LÓPEZ JORDÁN,DIVERSIFICADO,PRIVADO,URBANA,ABIERTA,MONOLINGUE,DOBLE,FIN DE SEMANA,IZABAL,INSTITUTO PARTICULAR ADONAI,INSTITUTO,INSTITUTO PARTICULAR ADONAI_CASERIO_LA_REFINERIA,ORIENTE,PRIVADO_MONOLINGUE_FIN_DE_SEMANA
18-01-0385-46,18-008,IZABAL,PUERTO BARRIOS,COLEGIO PARTICULAR MIXTO RAFAEL ALVAREZ OVALLE,ALDEA EL COROZO MILLA 4,53444994,ELENA ELIZABETH SUCHITE GARNICA DE QUINTANILLA,HEIDY ALEJANDRA ALDANA LÓPEZ,DIVERSIFICADO,PRIVADO,RURAL,ABIERTA,MONOLINGUE,DOBLE,FIN DE SEMANA,IZABAL,COLEGIO PARTICULAR RAFAEL ALVAREZ OVALLE,COLEGIO,COLEGIO PARTICULAR RAFAEL ALVAREZ OVALLE_ALDEA_EL_COROZO_MILLA_4,ORIENTE,PRIVADO_MONOLINGUE_FIN_DE_SEMANA
18-01-0394-46,18-008,IZABAL,PUERTO BARRIOS,LICEO DR. LUIS VON AHN,12 AVENIDA ENTRE 10 Y 11 CALLES,79480009,ELENA ELIZABETH SUCHITE GARNICA DE QUINTANILLA,ANGEL FELIPE LARIOS MELENDEZ,DIVERSIFICADO,PRIVADO,URBANA,ABIERTA,MONOLINGUE,DOBLE,FIN DE SEMANA,IZABAL,LICEO DR. LUIS VON AHN,LICEO,LICEO DR. LUIS VON AHN_12_AVENIDA_ENTRE_10_Y_11_CALLES,ORIENTE,PRIVADO_MONOLINGUE_FIN_DE_SEMANA
18-01-0400-46,18-008,IZABAL,PUERTO BARRIOS,CENTRO EDUCATIVO DE FORMACIÓN INTEGRAL SAN MARTÍN DE PORRES,5A AVENIDA ENTRE 3A. Y 4A. CALLES,41542920,ELENA ELIZABETH SUCHITE GARNICA DE QUINTANILLA,GUSTAVO ADOLFO BATRES ESPINOZA,DIVERSIFICADO,PRIVADO,URBANA,ABIERTA,MONOLINGUE,DOBLE,FIN DE SEMANA,IZABAL,CENTRO EDUCATIVO FORMACIÓN INTEGRAL SAN MARTÍN PORRES,CENTRO,CENTRO EDUCATIVO FORMACIÓN INTEGRAL SAN MARTÍN PORRES_5A_AVENIDA_ENTRE_3A._Y_4A._CALLES,ORIENTE,PRIVADO_MONOLINGUE_FIN_DE_SEMANA
18-01-0402-46,18-009,IZABAL,PUERTO BARRIOS,CENTRO DE DESARROLLO HUMANO TECNOLÓGICO ASOCIACION GRUPO CEIBA,"COLONIA SAN AGUSTIN, ALDEA SANTO TOMAS DE CASTILLA",41310547,ANA MARIBEL CASTILLO DIAZ,MARIA DEL CARMEN URIZAR CATALAN,DIVERSIFICADO,PRIVADO,RURAL,ABIERTA,MONOLINGUE,DOBLE,FIN DE SEMANA,IZABAL,CENTRO DESARROLLO HUMANO TECNOLOGICO ASOCIACION GRUPO CEIBA,CENTRO,"CENTRO DESARROLLO HUMANO TECNOLOGICO ASOCIACION GRUPO CEIBA_COLONIA_SAN_AGUSTIN,_ALDEA_SANTO_TOMAS_DE_CASTILLA",ORIENTE,PRIVADO_MONOLINGUE_FIN_DE_SEMANA
18-01-0403-46,18-008,IZABAL,PUERTO BARRIOS,COLEGIO MIXTO BILINGUE QUETZALLI,"COLONIA LAS FLORES, ALDEA SANTO TOMAS DE CASTILLA",31229254,ELENA ELIZABETH SUCHITE GARNICA DE QUINTANILLA,JUAN CARLOS LUCERO ALVARADO,DIVERSIFICADO,PRIVADO,RURAL,ABIERTA,MONOLINGUE,DOBLE,FIN DE SEMANA,IZABAL,COLEGIO BILINGUE QUETZALLI,COLEGIO,"COLEGIO BILINGUE QUETZALLI_COLONIA_LAS_FLORES,_ALDEA_SANTO_TOMAS_DE_CASTILLA",ORIENTE,PRIVADO_MONOLINGUE_FIN_DE_SEMANA
18-01-0404-46,18-008,IZABAL,PUERTO BARRIOS,LICEO TÉCNICO GUATEMALTECO IDETI,ALDEA PLACA NO.1,50184029,ELENA ELIZABETH SUCHITE GARNICA DE QUINTANILLA,GLORIA ELIZABETH REYES ALONZO,DIVERSIFICADO,PRIVADO,RURAL,ABIERTA,MONOLINGUE,DOBLE,FIN DE SEMANA,IZABAL,LICEO TECNICO GUATEMALTECO IDETI,LICEO,LICEO TECNICO GUATEMALTECO IDETI_ALDEA_PLACA_NO.1,ORIENTE,PRIVADO_MONOLINGUE_FIN_DE_SEMANA
18-01-0405-46,18-008,IZABAL,PUERTO BARRIOS,COLEGIO PARTICULAR MIXTO SHADDAI,3A. CALLE 1A. COLONIA SAN AGUSTIN SANTO TOMAS DE CASTILLA,79453430,ELENA ELIZABETH SUCHITE GARNICA DE QUINTANILLA,HERLINDO ARTIGA MARROQUIN,DIVERSIFICADO,PRIVADO,RURAL,ABIERTA,MONOLINGUE,DOBLE,FIN DE SEMANA,IZABAL,COLEGIO PARTICULAR SHADDAI,COLEGIO,COLEGIO PARTICULAR SHADDAI_3A._CALLE_1A._COLONIA_SAN_AGUSTIN_SANTO_TOMAS_DE_CASTILLA,ORIENTE,PRIVADO_MONOLINGUE_FIN_DE_SEMANA
18-01-0406-46,18-009,IZABAL,PUERTO BARRIOS,"PROGRAMA NACIONAL DE EDUCACIÓN ALTERNATIVA, PRONEA",20 AVENIDA 13-14 CALLES,30785700,ANA MARIBEL CASTILLO DIAZ,EDIN ROBERTO CHUN JUC,DIVERSIFICADO,OFICIAL,RURAL,ABIERTA,MONOLINGUE,DOBLE,A DISTANCIA,IZABAL,"PROGRAMA NACIONAL ALTERNATIVA, PRONEA",OTRO,"PROGRAMA NACIONAL ALTERNATIVA, PRONEA_20_AVENIDA_13-14_CALLES",ORIENTE,OFICIAL_MONOLINGUE_A_DISTANCIA
18-01-0409-46,18-008,IZABAL,PUERTO BARRIOS,COLEGIO CRISTIANO PRIVADO MIXTO CRISTO VIENE,ALDEA ENTRE RIOS,40620273,ELENA ELIZABETH SUCHITE GARNICA DE QUINTANILLA,GRICELDA MAGALY LEMUS CALDERON,DIVERSIFICADO,PRIVADO,RURAL,ABIERTA,MONOLINGUE,VESPERTINA,DIARIO(REGULAR),IZABAL,COLEGIO CRISTIANO CRISTO VIENE,COLEGIO,COLEGIO CRISTIANO CRISTO VIENE_ALDEA_ENTRE_RIOS,ORIENTE,PRIVADO_MONOLINGUE_DIARIO(REGULAR)
18-01-0413-46,18-008,IZABAL,PUERTO BARRIOS,CAB SCHOOL PUERTO BARRIOS,"RIO CACAO, KILOMETRO 292, RUTA AL ATLANTICO",59899442,ELENA ELIZABETH SUCHITE GARNICA DE QUINTANILLA,ROSSANA AIMÉE CHIAPAS GALLARDO,DIVERSIFICADO,PRIVADO,URBANA,ABIERTA,MONOLINGUE,MATUTINA,DIARIO(REGULAR),IZABAL,CAB SCHOOL PUERTO BARRIOS,OTRO,"CAB SCHOOL PUERTO BARRIOS_RIO_CACAO,_KILOMETRO_292,_RUTA_AL_ATLANTICO",ORIENTE,PRIVADO_MONOLINGUE_DIARIO(REGULAR)
18-01-0414-46,18-009,IZABAL,PUERTO BARRIOS,CENTRO DE EDUCACIÓN EXTRAESCOLAR -CEEX-DEPARTAMENTAL,20 AVENIDA 13 Y 14 CALLE,57175702,ANA MARIBEL CASTILLO DIAZ,MARÍA DEL CARMEN URIZAR CATALÁN,DIVERSIFICADO,OFICIAL,RURAL,ABIERTA,MONOLINGUE,DOBLE,DIARIO(REGULAR),IZABAL,CENTRO EXTRAESCOLAR -CEEX-DEPARTAMENTAL,CENTRO,CENTRO EXTRAESCOLAR -CEEX-DEPARTAMENTAL_20_AVENIDA_13_Y_14_CALLE,ORIENTE,OFICIAL_MONOLINGUE_DIARIO(REGULAR)
18-01-0415-46,18-008,IZABAL,PUERTO BARRIOS,COLEGIO MIXTO BILINGUE QUETZALLI,3A. CALLE 15 AVENIDA COLONIA LAS FLORES SANTO TOMAS DE CASTILLA,79600197,ELENA ELIZABETH SUCHITE GARNICA DE QUINTANILLA,JUAN CARLOS LUCERO ALVARADO,DIVERSIFICADO,PRIVADO,RURAL,ABIERTA,MONOLINGUE,VESPERTINA,DIARIO(REGULAR),IZABAL,COLEGIO BILINGUE QUETZALLI,COLEGIO,COLEGIO BILINGUE QUETZALLI_3A._CALLE_15_AVENIDA_COLONIA_LAS_FLORES_SANTO_TOMAS_DE_CASTILLA,ORIENTE,PRIVADO_MONOLINGUE_DIARIO(REGULAR)
18-01-0420-46,18-008,IZABAL,PUERTO BARRIOS,COLEGIO EDUCATIVO PRIVADO MIXTO DE FORMACION INTEGRAL EN COMPUTACION CEIF COMP,7A. AVE. ENTRE 14 Y 15 CALLE,79524695,ELENA ELIZABETH SUCHITE GARNICA DE QUINTANILLA,MARCO TULIO FLORES LÓPEZ,DIVERSIFICADO,PRIVADO,URBANA,ABIERTA,MONOLINGUE,SIN JORNADA,SEMIPRESENCIAL (FIN DE SEMANA),IZABAL,COLEGIO EDUCATIVO FORMACION INTEGRAL EN COMPUTACION CEIF COMP,COLEGIO,COLEGIO EDUCATIVO FORMACION INTEGRAL EN COMPUTACION CEIF COMP_7A._AVE._ENTRE_14_Y_15_CALLE,ORIENTE,PRIVADO_MONOLINGUE_SEMIPRESENCIAL_(FIN_DE_SEMANA)
18-01-0422-46,18-008,IZABAL,PUERTO BARRIOS,INSTITUTO PARTICULAR MIXTO DE BACHILLERATO POR MADUREZ DR. MARIANO GALVEZ,ALDEA SANTO TOMAS DE CASTILLA,58963256,ELENA ELIZABETH SUCHITE GARNICA DE QUINTANILLA,ELIA ERSELI FRANCO CALDERÓN,DIVERSIFICADO,PRIVADO,RURAL,ABIERTA,MONOLINGUE,SIN JORNADA,SEMIPRESENCIAL (UN DÍA A LA SEMANA),IZABAL,INSTITUTO PARTICULAR BACHILLERATO POR MADUREZ DR. MARIANO GALVEZ,INSTITUTO,INSTITUTO PARTICULAR BACHILLERATO POR MADUREZ DR. MARIANO GALVEZ_ALDEA_SANTO_TOMAS_DE_CASTILLA,ORIENTE,PRIVADO_MONOLINGUE_SEMIPRESENCIAL_(UN_DÍA_A_LA_SEMANA)
18-01-0424-46,18-008,IZABAL,PUERTO BARRIOS,COLEGIO PARTICULAR MIXTO MATIAS DE GALVEZ,"COLONIA PIEDRAS NEGRAS, ALDEA SANTO TOMÁS DE CASTILLA",56142325,ELENA ELIZABETH SUCHITE GARNICA DE QUINTANILLA,SINDY MARISOL NUÑEZ VALIENTE,DIVERSIFICADO,PRIVADO,RURAL,ABIERTA,MONOLINGUE,SIN JORNADA,SEMIPRESENCIAL (UN DÍA A LA SEMANA),IZABAL,COLEGIO PARTICULAR 'MATIAS GALVEZ',COLEGIO,"COLEGIO PARTICULAR 'MATIAS GALVEZ'_COLONIA_PIEDRAS_NEGRAS,_ALDEA_SANTO_TOMÁS_DE_CASTILLA",ORIENTE,PRIVADO_MONOLINGUE_SEMIPRESENCIAL_(UN_DÍA_A_LA_SEMANA)
18-01-0426-46,18-008,IZABAL,PUERTO BARRIOS,LICEO MIXTO BILINGÜE CANADIENSE,6A. CALLE Y 4A. AVENIDA,50307050,ELENA ELIZABETH SUCHITE GARNICA DE QUINTANILLA,WILMER EZEQUIEL MONGE MARTÍNEZ,DIVERSIFICADO,PRIVADO,URBANA,ABIERTA,MONOLINGUE,SIN JORNADA,SEMIPRESENCIAL (UN DÍA A LA SEMANA),IZABAL,LICEO BILINGÜE CANADIENSE,LICEO,LICEO BILINGÜE CANADIENSE_6A._CALLE_Y_4A._AVENIDA,ORIENTE,PRIVADO_MONOLINGUE_SEMIPRESENCIAL_(UN_DÍA_A_LA_SEMANA)
